{
  "schema_version": "golem.acceptance/v1",
  "overall": "PASS",
  "artifact": {
    "kind": "packed",
    "filename": "laveesingh-golem-5.1.1.tgz",
    "sha256": "a452a612bc09f6b0c082bd51e968563a09dbf1c8903b85b2ffd2d444fc835cf4",
    "files": 338,
    "package": "@laveesingh/golem",
    "version": "5.1.1"
  },
  "entry_gate": {
    "status": "PASS",
    "checkout_hidden": true,
    "postinstall_stopped": true,
    "render_targets": [
      "cc",
      "cc-marketplace",
      "codex",
      "opencode",
      "pi"
    ],
    "node": "v24.18.0",
    "npm": "11.16.0",
    "abi": "137",
    "platform": "darwin/arm64",
    "better_sqlite3": "12.11.1",
    "sqlite": "3.53.2",
    "openapi_fetch": "0.17.0",
    "wal_restart_integrity": "PASS",
    "install_flags": [
      "--omit=dev",
      "--foreground-scripts",
      "--no-audit",
      "--no-fund"
    ],
    "topology": {
      "status": "PASS",
      "typescript": {
        "root": "7.0.2",
        "codegen": "5.9.3",
        "openapi_typescript": "7.13.0"
      },
      "openapi_fetch": "0.17.0",
      "better_sqlite3": "12.11.1",
      "api_check": "PASS",
      "docs_check": "PASS"
    }
  },
  "matrices": [
    {
      "id": "J1",
      "status": "PASS",
      "scenarios": [
        {
          "id": "install-update-rollback",
          "status": "PASS",
          "regression": "a packed install depends on the checkout, auto-starts, loses user data/renders during update, or cannot recover atomically from a failed update",
          "evidence": "real npm 5.1.1→5.1.2-next.0→5.1.1, corrupt-update rollback, render user-region/config/plist preservation, SQLite WAL/integrity; tarball sha256=a452a612bc09f6b0c082bd51e968563a09dbf1c8903b85b2ffd2d444fc835cf4"
        },
        {
          "id": "dashboard-down-inbox-replay",
          "status": "PASS",
          "regression": "a temporary management/tracker outage drops durable runtime work instead of bounded, idempotent replay",
          "evidence": "independent filesystem producers remained lossless while the service was absent, then a fresh control-plane start replayed and archived every envelope"
        }
      ]
    },
    {
      "id": "J2",
      "status": "PASS",
      "scenarios": [
        {
          "id": "cross-harness-session-lifecycle",
          "status": "PASS",
          "regression": "cross-harness session generations, terminal lifecycle, aliases, and actor-vs-observation projections drift or resurrect",
          "evidence": "ℹ duration_ms 119.607334"
        },
        {
          "id": "project-identity-git-worktree-relocation",
          "status": "PASS",
          "regression": "nested Git paths, linked worktrees, relocation, and broad-root heuristics split or merge project identity",
          "evidence": "✔ J2 project identity follows Git roots, worktrees, relocation, and explicit registration (181.949291ms)\nℹ tests 1\nℹ suites 0\nℹ pass 1\nℹ fail 0\nℹ cancelled 0\nℹ skipped 0\nℹ todo 0\nℹ duration_ms 330.420667"
        }
      ]
    },
    {
      "id": "J3",
      "status": "PASS",
      "scenarios": [
        {
          "id": "materializer-crash-matrix",
          "status": "PASS",
          "regression": "concurrent runtime producers, a killed materializer, or duplicate delivery loses canonical state or emits a second outbox effect",
          "evidence": "100 independent producers, lease/poison/archive recovery, child crash replay, and exact redacted outbox state transitions verified"
        },
        {
          "id": "codex-managed-delivery-crash-matrix",
          "status": "PASS",
          "regression": "managed Codex App Server lifecycle, canonical thread resume, fenced delivery idempotency, and unsupported-provider pre-spawn rejection drift",
          "evidence": "real App Server process and SQLite boundary verified canonical managed start/resume, endpoint readiness, duplicate/stale fence refusal, one-turn delivery, control ownership, and direct-Codex remedy"
        }
      ]
    },
    {
      "id": "J4",
      "status": "PASS",
      "scenarios": [
        {
          "id": "claude-lifecycle-channel-recovery",
          "status": "PASS",
          "regression": "Claude lifecycle signals, fenced channel authentication, addressed consumption, and unqualified delivery can drift apart",
          "evidence": "real SQLite-backed Claude lifecycle signals, fenced channel handshake, addressed consumption qualification, and explicit unqualified failure evidence verified"
        },
        {
          "id": "tracker-http-mcp-parity",
          "status": "PASS",
          "regression": "bearer and MCP ticket dispatch can select a caller target, disagree with browser disposition, write legacy dispatch_queue, or report failure as command-time settlement",
          "evidence": "real managed SQLite bearer and MCP adapters share canonical ticket dispatch classification, trusted legacy content, target-free bearer refusal, terminal/stale no-envelope behavior, fence-stale prepare refusal, and later failure publication"
        },
        {
          "id": "delivery-api-fence-recheck",
          "status": "PASS",
          "regression": "durable delivery claims skip the canonical endpoint generation/fence/readiness recheck before adapter transport",
          "evidence": "real HTTP delivery enqueue/claim rechecks canonical endpoint fence and refuses stale work before any adapter boundary"
        }
      ]
    },
    {
      "id": "J5",
      "status": "PASS",
      "scenarios": [
        {
          "id": "compact-launcher-matrix",
          "status": "PASS",
          "regression": "daily compact launcher grammar, picker, preset persistence, completions, safe aliases, or compatibility shims drift from qualified resolver truth",
          "evidence": "J5 temporary-home matrix: compact scoped/global launches, picker/non-TTY behavior, explicit preset persistence, registry completions, non-native aliases, exact passthrough, and one-hop golemc/golemx compatibility verified"
        },
        {
          "id": "launcher-launchability-delivery-split",
          "status": "PASS",
          "regression": "a launchable process is rejected by unqualified delivery evidence or an unqualified delivery path is advertised as push-ready",
          "evidence": "temporary-home resolver matrix: launchable unknown-delivery Claude/Ollama, credential and launch preflight rejection, managed Codex boundary, OpenCode provider variants, canonical bridge, list/doctor parity, and secret-safe stable output verified"
        },
        {
          "id": "opencode-provider-coexistence",
          "status": "PASS",
          "regression": "OpenCode provider setup clobbers user providers or reports one provider as qualified for another's model/delivery facts",
          "evidence": "OpenCode shim → authenticated runtime ingress → canonical SQLite lifecycle, fenced promptAsync delivery, resume stale-fence rejection, redacted diagnostics, and direct non-mutating upstream launch verified"
        }
      ]
    },
    {
      "id": "J6",
      "status": "PASS",
      "scenarios": [
        {
          "id": "projection-ws-restart-resync",
          "status": "PASS",
          "regression": "authenticated scoped projection WebSocket snapshots, opaque invalidations, cursors, compaction/policy/restart resync, or project revisions diverge from the HTTP read model",
          "evidence": "real managed SQLite restart, scoped WebSocket replay compaction, policy change, and HTTP revision truth require resync instead of unsafe deltas"
        },
        {
          "id": "committed-outbox-all-write-paths",
          "status": "PASS",
          "regression": "a committed tracker, management, asset, delivery, bearer, MCP, or core write can omit an opaque scoped invalidation, or a stale/rejected/rolled-back write can emit one",
          "evidence": "real managed SQLite commits bearer HTTP, storage-free MCP, core, management, asset, and delivery acknowledgement/settlement writes with opaque scoped invalidations; stale and rolled-back writes emit nothing"
        },
        {
          "id": "roles-gates-ideas-controls",
          "status": "PASS",
          "regression": "typed management roles, human gates, idea promotion, and idempotent controls lose audit or restart state",
          "evidence": "ℹ duration_ms 266.626875"
        }
      ]
    },
    {
      "id": "J7",
      "status": "PASS",
      "scenarios": [
        {
          "id": "canonical-cutover-crash-rollback",
          "status": "PASS",
          "regression": "C4 can half-switch authority, lose post-cutover canonical facts, fail to resume after a crash, or make rollback destructive",
          "evidence": "representative SQLite home survives a crash and stale operation lock after quiesce, resumes the exact plan into one C4 authority, serves the real typed health route, emits revisioned read-only compatibility state, auto-rolls back on soak regression without deleting canonical data, re-cuts over idempotently, and resumes an audited rollback interrupted after its authority switch"
        },
        {
          "id": "migration-apply-crash-rollback",
          "status": "PASS",
          "regression": "a stale plan, weak alias, partial canonical import, or generated compatibility projection can become authoritative after a failed migration",
          "evidence": "real temporary homes prove exact-plan apply, strong aliases only, explicit unsupported-store review gates, immutable legacy bytes, canonical SQLite + generated read-only compatibility projection, hostile credential-path output redaction, and crash rollback"
        }
      ]
    },
    {
      "id": "J8",
      "status": "PASS",
      "scenarios": [
        {
          "id": "dashboard-runtime-lifecycle",
          "status": "PASS",